{
  "schemaVersion": 1,
  "asOf": "2026-08-13",
  "environment": "staging",
  "purpose": "Bind video architecture and product recommendations to explicit evidence and certification gates.",
  "evidence": [
    {
      "id": "abc-native-capacity",
      "status": "verified_observation",
      "strength": "committed_summary",
      "source": "development/video_poc/benchmarks/L40S_RUNTIME_CAPACITY_CAMPAIGN.md",
      "scope": "One staging L40S; H.264 1280x720 at native 60 FPS; YOLOv8 Nano; output disabled; one worker; threaded A/B/C runtimes.",
      "facts": {
        "strictMaxConcurrencyByVariant": {
          "a-legacy-pyav-thread": 2,
          "b-v14-pyav-thread": 2,
          "c-v14-nvdec-thread": 2
        },
        "firstRepeatedFailingConcurrency": 4,
        "cAggregateFpsByConcurrency": {
          "1": [57.397, 58.245],
          "2": [106.034, 105.44],
          "4": [142.179, 141.554],
          "8": [108.914, 102.056]
        },
        "interpretation": "C improved aggregate throughput above the strict knee without increasing the strict low-latency concurrency boundary. The first C failure was not whole-pod, relay, GPU, VRAM, or decoder saturation."
      }
    },
    {
      "id": "maxfps-ingest-gate",
      "status": "verified_observation",
      "strength": "committed_summary",
      "source": "development/video_poc/benchmarks/STAGING_EXPERIMENT_LEDGER.md",
      "scope": "A c1 source-rate-limiter validity gate, not a packing curve.",
      "facts": {
        "requestedFps": 5,
        "uploadedReplayDeliveredFps": [4.913, 4.84],
        "connectorReplayDeliveredFps": 4.999,
        "interpretation": "The maxFps path can attain its c1 target after the limiter flag change; controlled multi-stream capacity remains unmeasured."
      }
    },
    {
      "id": "def-image-and-process-smokes",
      "status": "verified_observation",
      "strength": "committed_summary",
      "source": "development/video_poc/experiments/process_isolation/JOB_PROCESS_MATRIX.md",
      "scope": "Credential-free image/import/spawn smokes for D/E/F only.",
      "facts": {
        "dSmokePassed": true,
        "eSmokePassed": true,
        "fSmokePassed": true,
        "capacityMeasured": false,
        "lifecycleFaultsMeasured": false
      }
    },
    {
      "id": "def-process-capacity-and-containment",
      "status": "pending",
      "strength": "none",
      "source": "development/video_poc/experiments/process_isolation/JOB_PROCESS_MATRIX.md",
      "scope": "D/E/F c1/c2 topology, selective cancellation, child crash, cleanup, then repeated capacity curves."
    },
    {
      "id": "cpu-legacy-preliminary-curve",
      "status": "preliminary_observation",
      "strength": "committed_summary_without_raw_reports",
      "source": "development/video_poc/benchmarks/cpu_sizing/README.md",
      "scope": "Historical Burstable CPU worker; YOLOv8 Nano; output disabled; mutable image evidence.",
      "facts": {
        "strictPassingConcurrency": 2,
        "nearMissConcurrency": 3,
        "clearFailureConcurrency": 4,
        "certificationAllowed": false
      }
    },
    {
      "id": "cpu-size-topology-and-workload-campaign",
      "status": "pending",
      "strength": "none",
      "source": "development/video_poc/benchmarks/cpu_sizing/README.md",
      "scope": "Guaranteed cpu-2/cpu-4/cpu-8 classes; thread/process; 5/8/10/15 FPS; light/heavy mixes; matched telemetry."
    },
    {
      "id": "output-and-workload-mix",
      "status": "pending",
      "strength": "none",
      "source": "development/video_poc/benchmarks/STAGING_CAMPAIGN.md",
      "scope": "Matched output off/on plus detection, tracking, dual-model, and segmentation arrivals."
    },
    {
      "id": "cross-workspace-fairness",
      "status": "pending",
      "strength": "none",
      "source": "development/video_poc/benchmarks/MULTI_WORKSPACE_FAIRNESS.md",
      "scope": "Balanced, delayed-arrival, heavy-neighbor, reverse-order, and output-noise runs across two staging workspaces."
    },
    {
      "id": "mmp-single-workspace-controls",
      "status": "preliminary_observation",
      "strength": "committed_summary_without_campaign_reports",
      "source": "development/video_poc/HANDOFF.md",
      "scope": "Single-workspace MMP smoke and legacy/direct/subprocess controls at 4K and 640p.",
      "facts": {
        "crossWorkspaceMeasured": false,
        "authorizationBoundaryCertified": false,
        "mpsMeasured": false,
        "interpretation": "The 4K subprocess regression disappeared in the 640p control, implicating ndarray shared-memory transport rather than proving a production manager topology."
      }
    },
    {
      "id": "mmp-cross-workspace-security-and-fairness",
      "status": "pending",
      "strength": "none",
      "source": "development/video_poc/experiments/process_isolation/README.md",
      "scope": "Per-job authorization, warm-model denial, result/slot separation, fair queues, backend failure, and tenant accounting."
    },
    {
      "id": "mps-capacity-fairness-and-faults",
      "status": "pending",
      "strength": "none",
      "source": "development/video_poc/benchmarks/STAGING_CAMPAIGN.md",
      "scope": "Exclusive L40S MMP comparison with MPS off/on and optional thread caps; throughput, latency, fairness, and faults."
    },
    {
      "id": "processor-and-relay-recovery",
      "status": "pending",
      "strength": "none",
      "source": "development/video_poc/benchmarks/fault_injection/README.md",
      "scope": "Startup loss, steady processor loss, relay replacement, exact pod identity, and verified post-replacement frame progress."
    },
    {
      "id": "selected-point-soaks",
      "status": "pending",
      "strength": "none",
      "source": "development/video_poc/benchmarks/STAGING_CAMPAIGN.md",
      "scope": "15-minute, 1-hour, 4-hour, and 12-hour staged stability gates."
    },
    {
      "id": "cell-placement-rfc",
      "status": "design_only",
      "strength": "reviewable_design",
      "source": "development/video_poc/MULTI_CELL_SCALING_RFC.md",
      "scope": "Sticky source home cell, cell-scoped job claims, explicit remote execution, relay shards, and dedicated placement policies."
    },
    {
      "id": "distributed-relay-and-wan-capacity",
      "status": "pending",
      "strength": "none",
      "source": "development/video_poc/benchmarks/networking/STAGING_NETWORK_BENCHMARK_PLAN.md",
      "scope": "Isolated LB, relay, CNI, node, cross-cell, cloud, and on-prem edges with source/fan-out curves."
    },
    {
      "id": "environment-cost-and-metering",
      "status": "pending",
      "strength": "none",
      "source": "development/video_poc/benchmarks/analysis/recommendations.py",
      "scope": "Worker, relay, bandwidth, control-plane, and failure-overhead cost inputs joined to successful service units."
    }
  ],
  "decisions": [
    {
      "id": "worker-topology",
      "certificationStatus": "provisional",
      "currentRecommendation": {
        "action": "Use one OS process per job as the leading isolation and scaling candidate, but do not select it for deployment until D/E/F lifecycle and capacity gates pass.",
        "scope": "GPU stream jobs; decoder, workflow, model, CUDA context, and publisher stay in the child; frames and tensors do not cross supervisor IPC.",
        "doNotClaim": "The image smokes do not prove selective cancellation, crash containment, capacity, security isolation, or a production worker class."
      },
      "evidenceIds": [
        "abc-native-capacity",
        "def-image-and-process-smokes",
        "def-process-capacity-and-containment",
        "selected-point-soaks"
      ],
      "certificationRequirements": [
        {
          "id": "distinct-job-processes",
          "status": "pending",
          "evidenceIds": ["def-process-capacity-and-containment"],
          "requirement": "At c2, the supervisor and both jobs have distinct PIDs and the runtime identity matches the exact D/E/F digest."
        },
        {
          "id": "selective-cancel-and-crash",
          "status": "pending",
          "evidenceIds": ["def-process-capacity-and-containment"],
          "requirement": "Cancel or kill one child without interrupting sibling frame progress; sanitize the failure and return activeJobs to zero."
        },
        {
          "id": "topology-capacity-comparison",
          "status": "pending",
          "evidenceIds": ["def-process-capacity-and-containment"],
          "requirement": "Run repeated, identical D/E/F curves through the first repeated failure and compare strict capacity, latency, resources, startup, and cleanup with A/B/C."
        },
        {
          "id": "topology-soak",
          "status": "pending",
          "evidenceIds": ["selected-point-soaks"],
          "requirement": "The selected topology passes the staged soak progression without process, memory, CUDA, counter, or publisher drift."
        }
      ],
      "unknowns": [
        "Whether per-job processes move the c2 strict native-rate knee.",
        "The independent-CUDA-context cost before MPS or a shared model manager.",
        "Whether process cleanup remains bounded during model load and output publication."
      ]
    },
    {
      "id": "gpu-stream-capacity-and-slo",
      "certificationStatus": "provisional",
      "currentRecommendation": {
        "action": "Treat c2 as the strict maximum only for the measured native-rate 720p YOLO output-off A/B/C profiles; keep the product packing limit unknown.",
        "scope": "One L40S, one worker, native 60 FPS connector stream, strict p95 50 ms and p99 150 ms gates.",
        "doNotClaim": "Do not generalize c2 to 5/10/15 FPS service tiers, other resolutions, output publishing, heavy workflows, MMP, or long-lived operation."
      },
      "evidenceIds": [
        "abc-native-capacity",
        "maxfps-ingest-gate",
        "def-process-capacity-and-containment",